leela-zero-0.17-win64/leelaz_opencl_tuning
1;XgemmBatched;256;50;256;36; -DKWG=32 -DKWI=2 -DMDIMA=16 -DMDIMC=16 -DMWG=64 -DNDIMB=8 -DNDIMC=8 -DNWG=64 -DSA=1 -DSB=1 -DSTRM=0 -DSTRN=0 -DTCE=0 -DVWM=4 -DVWN=2;OpenCL: NVIDIA Corporation GeForce GTX 1070 @ 1695MHz
1;XgemmBatchedHalf;256;50;256;36; -DKWG=16 -DKWI=8 -DMDIMA=8 -DMDIMC=8 -DMWG=32 -DNDIMB=8 -DNDIMC=8 -DNWG=64 -DSA=1 -DSB=1 -DSTRM=0 -DSTRN=0 -DTCE=0 -DVWM=4 -DVWN=2;OpenCL: NVIDIA Corporation GeForce GTX 1070 @ 1695MHz
1;XgemmBatched;256;125;256;36; -DKWG=16 -DKWI=2 -DMDIMA=16 -DMDIMC=16 -DMWG=64 -DNDIMB=8 -DNDIMC=8 -DNWG=64 -DSA=1 -DSB=1 -DSTRM=0 -DSTRN=0 -DTCE=0 -DVWM=4 -DVWN=2;OpenCL: NVIDIA Corporation GeForce GTX 1070 @ 1695MHz
1;XgemmBatchedHalf;256;125;256;36; -DKWG=32 -DKWI=8 -DMDIMA=8 -DMDIMC=8 -DMWG=64 -DNDIMB=8 -DNDIMC=8 -DNWG=64 -DSA=1 -DSB=1 -DSTRM=0 -DSTRN=0 -DTCE=0 -DVWM=4 -DVWN=4;OpenCL: NVIDIA Corporation GeForce GTX 1070 @ 1695MHz
